{
  "packageVersion": "resume-data-package@v4",
  "packageType": "resume-data-export",
  "exportedAt": "2026-04-02T12:33:00.815Z",
  "source": {
    "site": "https://zgx197.top",
    "resumePath": "/resume",
    "jsonPath": "/resume.json",
    "metaPath": "/resume.meta.json",
    "schemaPath": "/resume.schema.json"
  },
  "resume": {
    "schemaVersion": "resume-schema@v1",
    "profile": {
      "name": "张国鑫",
      "role": "现游戏开发工程师，前知识图谱 / NLP 算法工程师",
      "bio": "目前关注 AI 游戏应用、系统架构、性能优化与程序化生成。",
      "strengths": [
        "擅长把复杂需求抽成可维护的系统边界，再落到可迭代的工程实现。",
        "既能做游戏玩法与运行时系统，也能做编辑器工具、DSL 与框架抽象。",
        "有 NLP / 知识图谱基础设施背景，习惯用长期维护视角看待技术设计。",
        "游戏引擎：熟悉 Unity 游戏引擎中常见组件和工具的使用方法",
        "编程语言：能够熟练使用 C#/C++、Python和 Shell 编程，了解常见的设计模式",
        "沟通能力：主动推进项目进度，在工作中遇到问题能够及时有效的进行沟通",
        "学习能力：学习能力强，能主动学习相关技术知识",
        "工作态度：工作认真负责，能在基础工作上再多想一步",
        "算法/数据结构：熟练掌握传统的算法和数据结构，熟悉常见 NLP 深度学习算法、模型、传统与文本相关的机器学习算法"
      ],
      "contacts": [
        {
          "label": "简历",
          "href": "/resume"
        },
        {
          "label": "GitHub",
          "href": "https://github.com/zgx197",
          "external": true
        },
        {
          "label": "Steam",
          "href": "https://steamcommunity.com/profiles/76561198340584094",
          "external": true
        },
        {
          "label": "Email",
          "href": "mailto:guoxin_zhang@outlook.com"
        }
      ]
    },
    "resume": {
      "headline": "现游戏开发工程师，前知识图谱 / NLP 算法工程师。目前关注 AI 游戏应用、系统架构、性能优化与程序化生成。",
      "summaryPoints": [
        "近年的工作重点分布在 Unity 游戏研发、编辑器工具链和运行时架构。",
        "既能做玩法系统与运行时工程，也能做工具、DSL 和框架抽象。",
        "知识图谱与 NLP 背景让我更关注抽象、验证和长期可维护性。",
        "游戏引擎：熟悉 Unity 游戏引擎中常见组件和工具的使用方法",
        "编程语言：能够熟练使用 C#/C++、Python和 Shell 编程，了解常见的设计模式",
        "沟通能力：主动推进项目进度，在工作中遇到问题能够及时有效的进行沟通"
      ],
      "focusAreas": [
        {
          "title": "Unity 游戏开发",
          "description": "关注玩法系统、运行时架构、程序化生成与性能优化。"
        },
        {
          "title": "工具链与框架",
          "description": "偏好把复杂问题抽成可维护的编辑器工具、DSL 与运行时系统。"
        },
        {
          "title": "AI / NLP 背景",
          "description": "有知识图谱、模型、数据工程和服务部署经验。"
        },
        {
          "title": "方向 1",
          "description": "游戏引擎：熟悉 Unity 游戏引擎中常见组件和工具的使用方法"
        },
        {
          "title": "方向 2",
          "description": "编程语言：能够熟练使用 C#/C++、Python和 Shell 编程，了解常见的设计模式"
        },
        {
          "title": "方向 3",
          "description": "沟通能力：主动推进项目进度，在工作中遇到问题能够及时有效的进行沟通"
        }
      ],
      "profileFacts": [
        {
          "label": "技术能力",
          "value": "游戏开发 / AI 游戏应用 / 系统架构 / 性能优化 / 程序化生成"
        },
        {
          "label": "相关背景",
          "value": "知识图谱 / NLP / 数据工程 / 服务部署"
        },
        {
          "label": "擅长事项",
          "value": "复杂系统拆解 / 数据驱动设计 / 工具链建设 / 工程落地"
        },
        {
          "label": "联系方式",
          "value": "guoxin_zhang@outlook.com"
        },
        {
          "label": "求职意向",
          "value": "U3D"
        },
        {
          "label": "电话",
          "value": "18646278970"
        },
        {
          "label": "邮箱",
          "value": "guoxin_zhang@outlook.com"
        },
        {
          "label": "主页",
          "value": "https://steamcommunity.com/profiles/76561198340584094"
        },
        {
          "label": "主页",
          "value": "https://github.com/zgx197"
        }
      ],
      "experiences": [
        {
          "id": "北京畅聊天下科技有限公司-2025-07",
          "company": "北京畅聊天下科技有限公司",
          "role": "Unity开发工程师",
          "period": "2025.07-至今",
          "summary": "负责公司核心 Unity 编辑器平台与战斗基础设施研发，主导场景设计平台、场景蓝图框架、Framesync 技能编辑器与技能运行时等核心模块建设，推动工具链与运行时系统的平台化演进。",
          "bullets": [
            "主导 StageDesigner / SnapGridFlow 场景设计平台架构演进，统一场景身份、会话入口、模块装配与构建配置，支撑多场景类型在一致生命周期下运行。",
            "设计并落地 SceneBlueprint 场景蓝图框架，打通 DSL 定义、可视化编辑、场景语义绑定、导出契约、运行时解释执行与调试回放链路。",
            "主导 Framesync 技能逻辑编辑器建设，沉淀技能蓝图资产、时间轴编排、沙盒预览、导入导出与自动收口能力，提升技能内容生产闭环效率。",
            "负责 Framesync 技能释放与执行系统架构，拆分释放控制层与技能执行层，统一多来源释放入口、状态推进、能力调度、伤害结算与表现联动链路。",
            "持续推动 AI Agent 与大模型辅助研发工作流接入游戏工具链，围绕复杂系统分析、知识辅助与流程提效预留结构化能力入口。"
          ],
          "details": {
            "refinedTitle": "详细补充",
            "refined": [
              "工作内容覆盖 Unity 编辑器平台与战斗基础设施两条主线，包括场景设计、场景蓝图、技能编辑工具链，以及确定性技能运行时主链路建设。",
              "除核心系统研发外，也持续推动 AI Agent 与大模型辅助研发工作流在游戏工具链中的落地，围绕复杂系统分析、知识辅助和研发提效预留结构化接入能力。"
            ],
            "originalTitle": "简历原文",
            "original": [
              "工作内容：负责公司核心 Unity 编辑器平台与战斗基础设施研发，主导 StageDesigner、SnapGridFlow、SceneBlueprint、Framesync 技能逻辑编辑器、Framesync 技能释放与执行系统等核心模块建设，覆盖场景设计工具链、场景级蓝图框架、确定性技能编辑、技能运行时主链路及相关导入导出、调试验证和资产收口流程，持续推动内容生产工具与运行时系统的平台化、结构化演进。除核心系统研发外，持续推动 AI Agent 与大模型辅助研发工作流在游戏工具链中的落地，围绕复杂系统分析、知识辅助和研发提效预留结构化接入能力。"
            ]
          },
          "projectSlugs": [
            "framesync-skill-runtime",
            "framesync-skill-editor",
            "sceneblueprint-work",
            "stage-designer"
          ]
        },
        {
          "id": "yaoxiang-2024-02",
          "company": "遥响动漫设计（北京）有限公司",
          "role": "U3D 游戏开发工程师",
          "period": "2024.02 - 2025.06",
          "summary": "负责 2D 俯视角沙盒修仙原型项目的核心系统与底层架构研发，覆盖基础框架、世界生成、玩法系统与性能优化。",
          "bullets": [
            "基于 GameFramework 做二次开发，并用 MVC 思路搭建核心数据流和基础框架。",
            "从零实现 Hex Grid 世界生成、法宝策略背包、随机事件与社会关系等关键系统。",
            "主导 protobuf-net 存档优化，并结合预加载、对象池、分帧执行和动态 LOD 提升运行时性能。",
            "搭建混合配置方案与上下文输入管理框架，支撑策划迭代与复杂交互场景。",
            "设计人口热力图、首都定位与国家边界扩张等文明演化模拟逻辑。"
          ],
          "details": {
            "refinedTitle": "详细补充",
            "refined": [
              "负责基础框架、数据驱动流程、配置方案、世界生成、法宝策略背包、随机事件、社会关系与存档优化。",
              "项目处于早期原型验证阶段，已完成基础框架、数据驱动流程和多系统联动骨架搭建。",
              "已实现配置方案、世界生成、法宝策略背包、随机事件、社会关系与存档优化等核心模块。"
            ],
            "originalTitle": "简历原文",
            "original": [
              "项目设计深受《环世界》启发，其核心特色是通过程序化生成的开放世界、深度模拟的角色行为与社会关系，以及由 AI 驱动的动态故事系统，为玩家创造独一无二的修仙宗门经营体验。"
            ]
          },
          "projectSlugs": [
            "xiuxian-game"
          ]
        },
        {
          "id": "北京百度网讯科技有限公司-2020-07",
          "company": "北京百度网讯科技有限公司",
          "role": "算法工程师",
          "period": "2020.07-2023.04",
          "summary": "围绕中文短文本理解建设知识底座、知识标注模型、数据工程和服务部署能力，支撑搜索、广告、AIGC 等业务方向。",
          "bullets": [
            "建设 TermTree 知识底座并沉淀百万级知识节点，支撑多项在线、离线知识理解任务。",
            "参与多任务短文本知识标注模型与标签体系设计，服务搜索、广告、AIGC 等场景。",
            "从 0 到 1 构建训练样本、测试集和评测流程，降低模型升级风险。",
            "研发 term-linking 和知识挖掘策略，提升文本到知识节点映射的稳定性与可解释性。",
            "负责 GPU 和 CPU 集群部署，形成面向多业务线的稳定服务支撑能力。"
          ],
          "details": {
            "refinedTitle": "详细补充",
            "refined": [
              "工作内容覆盖知识库、模型、训练数据、评测和服务部署等环节，面向中文短文本理解能力建设。",
              "负责 TermTree 知识底座、标签体系与模型训练、term-linking 策略、评测体系和服务落地，覆盖从知识生产到业务使用的完整链路。"
            ],
            "originalTitle": "简历原文",
            "original": [
              "短文本知识标注工具集研发：项目从词汇理解和句子理解两个层面探索中文通用知识表征与应用，通过构建中文全词类知识库并将短文本与通用词汇知识体系相关联，提升模型对中文语句的概念、实体、意图和主题理解能力。"
            ]
          },
          "projectSlugs": [
            "knowledge-graph"
          ]
        },
        {
          "id": "北京百度网讯科技有限公司-2018-09",
          "company": "北京百度网讯科技有限公司",
          "role": "算法工程师",
          "period": "2018.09-2020.07",
          "summary": "负责两千万级百科词条入库与知识库扩充，聚焦流程设计、分类关联策略和天级数据更新链路建设。",
          "bullets": [
            "设计从预处理到知识库更新的完整计算链路，明确各阶段输入输出与迭代边界。",
            "结合分类模型、消歧重召回与定义句特征细化，提升词条类别判定与知识节点映射质量。",
            "搭建 Airflow 天级更新流程，并将结果推送到业务方数据库，支撑百科结构化数据能力。"
          ],
          "details": {
            "refinedTitle": "详细补充",
            "refined": [
              "工作内容聚焦知识库扩充基础设施建设，将海量百科词条转换为可进入知识库的实体与概念词。",
              "负责流程设计、分类与关联策略，以及例行数据生产链路搭建，支撑大规模知识入库与日常更新。"
            ],
            "originalTitle": "简历原文",
            "original": [
              "百度百科词条与知识库关联项目：本项目是将两千万百科词条收录入知识库中以扩充知识库里的实体和概念词数量，主要通过多种分类策略对输入的百科页面进行分类细化，得到一个精准的词条类别，进而将该词条与知识库中的概念节点相关联。"
            ]
          },
          "projectSlugs": [
            "baike-knowledge-base"
          ]
        }
      ],
      "skillGroups": [
        {
          "title": "引擎与语言",
          "items": [
            "Unity",
            "C#",
            "C++",
            "Python",
            "Shell"
          ]
        },
        {
          "title": "游戏系统",
          "items": [
            "GameFramework",
            "数据驱动",
            "程序化生成",
            "关系图系统",
            "Unity Input System"
          ]
        },
        {
          "title": "工具与框架",
          "items": [
            "Editor Tooling",
            "Node Graph",
            "DSL",
            "Code Generation",
            "Runtime Interpreter"
          ]
        },
        {
          "title": "AI / NLP",
          "items": [
            "知识图谱",
            "Prompt Learning",
            "序列标注",
            "数据工程",
            "服务部署"
          ]
        },
        {
          "title": "游戏引擎",
          "items": [
            "熟悉 Unity 游戏引擎中常见组件",
            "工具的使用方法"
          ]
        },
        {
          "title": "编程语言",
          "items": [
            "能够熟练使用 C#",
            "C++",
            "Python",
            "Shell 编程",
            "了解常见的设计模式"
          ]
        },
        {
          "title": "沟通能力",
          "items": [
            "主动推进项目进度",
            "在工作中遇到问题能够及时有效的进行沟通"
          ]
        },
        {
          "title": "学习能力",
          "items": [
            "学习能力强",
            "能主动学习相关技术知识"
          ]
        },
        {
          "title": "工作态度",
          "items": [
            "工作认真负责",
            "能在基础工作上再多想一步"
          ]
        },
        {
          "title": "算法/数据结构",
          "items": [
            "熟练掌握传统的算法",
            "数据结构",
            "熟悉常见 NLP 深度学习算法",
            "模型",
            "传统与文本相关的机器学习算法"
          ]
        },
        {
          "title": "待整理技能",
          "items": [
            "请根据原始简历补充技能分组"